{
  "metadata": {
    "description": "Canonical diagnostic aggregates for Paper 1.",
    "diagnostic_max_std_selection": "Per checkpoint, metrics are taken from the max-std history-only row of eval_results/diagnostics/predictor_sensitivity.json.",
    "history_noise_only": true,
    "related_eval_source": "canonical_evals_20260517.json",
    "scope": "4 tasks \u00d7 9 checkpoints with predictor metrics for Table 4 / Table 4b / Figure 3, plus finalized Table 3 representative diagnostic values."
  },
  "predictor_metrics_by_task": {
    "Cube": {
      "0.0": {
        "diagnostic_max_std": 0.1,
        "predictor_rollout_T8_l2_at_max_std": 20.19550323486328,
        "predictor_target_to_nn_cos_ratio_at_max_std": 3.391514769198941e-06,
        "subdir": "cube_lewm_20260430"
      },
      "0.001": {
        "diagnostic_max_std": 0.1,
        "predictor_rollout_T8_l2_at_max_std": 19.25467300415039,
        "predictor_target_to_nn_cos_ratio_at_max_std": 3.4391118149826625e-06,
        "subdir": "cube_lewm_noise_0to001_p1"
      },
      "0.002": {
        "diagnostic_max_std": 0.1,
        "predictor_rollout_T8_l2_at_max_std": 0.31530702114105225,
        "predictor_target_to_nn_cos_ratio_at_max_std": 3.6484765786046035e-06,
        "subdir": "cube_lewm_noise_0to002_p1"
      },
      "0.003": {
        "diagnostic_max_std": 0.1,
        "predictor_rollout_T8_l2_at_max_std": 7.531859397888184,
        "predictor_target_to_nn_cos_ratio_at_max_std": 1.757943487390711e-06,
        "subdir": "cube_lewm_noise_0to003_p1"
      },
      "0.004": {
        "diagnostic_max_std": 0.1,
        "predictor_rollout_T8_l2_at_max_std": 4.378317832946777,
        "predictor_target_to_nn_cos_ratio_at_max_std": 1.82397875429547e-06,
        "subdir": "cube_lewm_noise_0to004_p1"
      },
      "0.005": {
        "diagnostic_max_std": 0.1,
        "predictor_rollout_T8_l2_at_max_std": 0.1918872743844986,
        "predictor_target_to_nn_cos_ratio_at_max_std": 4.3841670192267645e-06,
        "subdir": "cube_lewm_noise_0to005_p1"
      },
      "0.006": {
        "diagnostic_max_std": 0.1,
        "predictor_rollout_T8_l2_at_max_std": 1.229392647743225,
        "predictor_target_to_nn_cos_ratio_at_max_std": 1.8679141842865455e-06,
        "subdir": "cube_lewm_noise_0to006_p1"
      },
      "0.007": {
        "diagnostic_max_std": 0.1,
        "predictor_rollout_T8_l2_at_max_std": 0.7202308177947998,
        "predictor_target_to_nn_cos_ratio_at_max_std": 1.7735181812216349e-06,
        "subdir": "cube_lewm_noise_0to007_p1"
      },
      "0.008": {
        "diagnostic_max_std": 0.1,
        "predictor_rollout_T8_l2_at_max_std": 0.5977239608764648,
        "predictor_target_to_nn_cos_ratio_at_max_std": 1.9958187596984316e-06,
        "subdir": "cube_lewm_noise_0to008_p1"
      }
    },
    "PushT": {
      "0.0": {
        "diagnostic_max_std": 0.1,
        "predictor_rollout_T8_l2_at_max_std": 18.65480613708496,
        "predictor_target_to_nn_cos_ratio_at_max_std": 3.5410576785179965e-06,
        "subdir": "pusht_lewm_20260430"
      },
      "0.001": {
        "diagnostic_max_std": 0.1,
        "predictor_rollout_T8_l2_at_max_std": 11.915441513061523,
        "predictor_target_to_nn_cos_ratio_at_max_std": 3.5469388587546873e-06,
        "subdir": "pusht_lewm_noise_0to001_p1"
      },
      "0.002": {
        "diagnostic_max_std": 0.1,
        "predictor_rollout_T8_l2_at_max_std": 5.995233058929443,
        "predictor_target_to_nn_cos_ratio_at_max_std": 3.475586179331558e-06,
        "subdir": "pusht_lewm_noise_0to002_p1"
      },
      "0.003": {
        "diagnostic_max_std": 0.1,
        "predictor_rollout_T8_l2_at_max_std": 3.289700984954834,
        "predictor_target_to_nn_cos_ratio_at_max_std": 3.5673038763215746e-06,
        "subdir": "pusht_lewm_noise_0to003_p1"
      },
      "0.004": {
        "diagnostic_max_std": 0.1,
        "predictor_rollout_T8_l2_at_max_std": 2.718679904937744,
        "predictor_target_to_nn_cos_ratio_at_max_std": 3.7920263166626377e-06,
        "subdir": "pusht_lewm_noise_0to004_p1"
      },
      "0.005": {
        "diagnostic_max_std": 0.1,
        "predictor_rollout_T8_l2_at_max_std": 3.564171075820923,
        "predictor_target_to_nn_cos_ratio_at_max_std": 4.170515705119516e-06,
        "subdir": "pusht_lewm_noise_0to005_p1"
      },
      "0.006": {
        "diagnostic_max_std": 0.1,
        "predictor_rollout_T8_l2_at_max_std": 1.8319288492202759,
        "predictor_target_to_nn_cos_ratio_at_max_std": 3.8038578726544462e-06,
        "subdir": "pusht_lewm_noise_0to006_p1_20260507"
      },
      "0.007": {
        "diagnostic_max_std": 0.1,
        "predictor_rollout_T8_l2_at_max_std": 1.4037065505981445,
        "predictor_target_to_nn_cos_ratio_at_max_std": 3.937484557677751e-06,
        "subdir": "pusht_lewm_noise_0to007_p1"
      },
      "0.008": {
        "diagnostic_max_std": 0.1,
        "predictor_rollout_T8_l2_at_max_std": 1.0636807680130005,
        "predictor_target_to_nn_cos_ratio_at_max_std": 3.830404988719458e-06,
        "subdir": "pusht_lewm_noise_0to008_p1"
      }
    },
    "Reacher": {
      "0.0": {
        "diagnostic_max_std": 0.1,
        "predictor_rollout_T8_l2_at_max_std": 15.166336059570312,
        "predictor_target_to_nn_cos_ratio_at_max_std": 2.6658609842358752e-05,
        "subdir": "reacher_lewm_20260430"
      },
      "0.001": {
        "diagnostic_max_std": 0.1,
        "predictor_rollout_T8_l2_at_max_std": 7.121633529663086,
        "predictor_target_to_nn_cos_ratio_at_max_std": 1.8140589569160997e-05,
        "subdir": "reacher_lewm_noise_0to001_p1"
      },
      "0.002": {
        "diagnostic_max_std": 0.1,
        "predictor_rollout_T8_l2_at_max_std": 0.23401238024234772,
        "predictor_target_to_nn_cos_ratio_at_max_std": 9.55214756157553e-06,
        "subdir": "reacher_lewm_noise_0to002_p1"
      },
      "0.003": {
        "diagnostic_max_std": 0.1,
        "predictor_rollout_T8_l2_at_max_std": 1.1631649732589722,
        "predictor_target_to_nn_cos_ratio_at_max_std": 9.321097838903465e-06,
        "subdir": "reacher_lewm_noise_0to003_p1"
      },
      "0.004": {
        "diagnostic_max_std": 0.1,
        "predictor_rollout_T8_l2_at_max_std": 0.7411971092224121,
        "predictor_target_to_nn_cos_ratio_at_max_std": 9.22658178211427e-06,
        "subdir": "reacher_lewm_noise_0to004_p1"
      },
      "0.005": {
        "diagnostic_max_std": 0.1,
        "predictor_rollout_T8_l2_at_max_std": 0.20635083317756653,
        "predictor_target_to_nn_cos_ratio_at_max_std": 1.1322335571381664e-05,
        "subdir": "reacher_lewm_noise_0to005_p1"
      },
      "0.006": {
        "diagnostic_max_std": 0.1,
        "predictor_rollout_T8_l2_at_max_std": 0.44417667388916016,
        "predictor_target_to_nn_cos_ratio_at_max_std": 9.172797152763764e-06,
        "subdir": "reacher_lewm_noise_0to006_p1"
      },
      "0.007": {
        "diagnostic_max_std": 0.1,
        "predictor_rollout_T8_l2_at_max_std": 0.39588016271591187,
        "predictor_target_to_nn_cos_ratio_at_max_std": 9.088430428065072e-06,
        "subdir": "reacher_lewm_noise_0to007_p1"
      },
      "0.008": {
        "diagnostic_max_std": 0.1,
        "predictor_rollout_T8_l2_at_max_std": 0.3573140501976013,
        "predictor_target_to_nn_cos_ratio_at_max_std": 9.33510700366403e-06,
        "subdir": "reacher_lewm_noise_0to008_p1"
      }
    },
    "TwoRoom": {
      "0.0": {
        "diagnostic_max_std": 0.1,
        "predictor_rollout_T8_l2_at_max_std": 18.61800765991211,
        "predictor_target_to_nn_cos_ratio_at_max_std": 0.00015102204166698129,
        "subdir": "tworoom_lewm_20260430"
      },
      "0.001": {
        "diagnostic_max_std": 0.1,
        "predictor_rollout_T8_l2_at_max_std": 12.258934020996094,
        "predictor_target_to_nn_cos_ratio_at_max_std": 7.383561239256918e-05,
        "subdir": "tworoom_lewm_noise_0to001_p1"
      },
      "0.002": {
        "diagnostic_max_std": 0.1,
        "predictor_rollout_T8_l2_at_max_std": 3.801697254180908,
        "predictor_target_to_nn_cos_ratio_at_max_std": 6.084020320627871e-05,
        "subdir": "tworoom_lewm_noise_0to002_p1"
      },
      "0.003": {
        "diagnostic_max_std": 0.1,
        "predictor_rollout_T8_l2_at_max_std": 2.7217798233032227,
        "predictor_target_to_nn_cos_ratio_at_max_std": 5.136898340781836e-05,
        "subdir": "tworoom_lewm_noise_0to003_p1"
      },
      "0.004": {
        "diagnostic_max_std": 0.1,
        "predictor_rollout_T8_l2_at_max_std": 1.8288233280181885,
        "predictor_target_to_nn_cos_ratio_at_max_std": 3.448454230391227e-05,
        "subdir": "tworoom_lewm_noise_0to004_p1"
      },
      "0.005": {
        "diagnostic_max_std": 0.1,
        "predictor_rollout_T8_l2_at_max_std": 0.9688504934310913,
        "predictor_target_to_nn_cos_ratio_at_max_std": 3.4297669473359284e-05,
        "subdir": "tworoom_lewm_noise_0to005_p1"
      },
      "0.006": {
        "diagnostic_max_std": 0.1,
        "predictor_rollout_T8_l2_at_max_std": 0.7883489727973938,
        "predictor_target_to_nn_cos_ratio_at_max_std": 3.4424000413088e-05,
        "subdir": "tworoom_lewm_noise_0to006_p1"
      },
      "0.007": {
        "diagnostic_max_std": 0.1,
        "predictor_rollout_T8_l2_at_max_std": 0.7004826068878174,
        "predictor_target_to_nn_cos_ratio_at_max_std": 3.680800942285041e-05,
        "subdir": "tworoom_lewm_noise_0to007_p1"
      },
      "0.008": {
        "diagnostic_max_std": 0.1,
        "predictor_rollout_T8_l2_at_max_std": 0.6564038395881653,
        "predictor_target_to_nn_cos_ratio_at_max_std": 3.95522683225883e-05,
        "subdir": "tworoom_lewm_noise_0to008_p1"
      }
    }
  },
  "published_correlations": {
    "table4_ood_drop": {
      "Cube": {
        "predictor_rollout_T8_l2_at_max_std": {
          "pearson": 0.92,
          "spearman": 0.54
        },
        "predictor_target_to_nn_cos_ratio_at_max_std": {
          "pearson": 0.36,
          "spearman": 0.21